{
  "registry_id": "AIO-COMMERCE-v1",
  "version": "1.0",
  "updated": "2026-09-25",
  "primary_public_brand": "AIO CODE",
  "entity_ids": [
    "MC-001",
    "AIO-001",
    "VOID-001"
  ],
  "purpose": "Record commercial context, brand relationships, placements, music/playlists, calls to action, rights, commercial signals, and revenue attribution without inferring permissions or results.",
  "status_values": [
    "ORGANIC",
    "GIFT",
    "PAID",
    "AFF",
    "OWN"
  ],
  "records": [
    {
      "asset_id": "M01",
      "asset_type": "music_track",
      "title": "unknown",
      "platform": "unknown",
      "url": null,
      "commercial_status": "unknown",
      "brand_relation": "unknown",
      "product_placement": "unknown",
      "cta": "unknown",
      "rights_state": "unknown",
      "disclosure_state": "unknown",
      "commercial_signal": "not_collected",
      "revenue_attribution": "not_collected",
      "record_status": "planned",
      "note": "Asset identifier mentioned in project planning; title, source, link, license, and publication state are not verified in this repository."
    },
    {
      "asset_id": "PL01",
      "asset_type": "music_playlist",
      "title": "unknown",
      "platform": "unknown",
      "url": null,
      "commercial_status": "unknown",
      "brand_relation": "unknown",
      "product_placement": "unknown",
      "cta": "unknown",
      "rights_state": "unknown",
      "disclosure_state": "unknown",
      "commercial_signal": "not_collected",
      "revenue_attribution": "not_collected",
      "record_status": "planned",
      "note": "Playlist identifier mentioned in project planning; title, source, link, rights, and publication state are not verified in this repository."
    }
  ],
  "rules": [
    "A blank or unknown rights field is not permission.",
    "Do not mark PAIDREADY while material rights, partner approval, or disclosure requirements are unknown.",
    "Revenue attribution requires a defined source and measurement window; do not infer revenue from views, engagement, or a CTA.",
    "Keep platform metrics and commercial terms scoped to the individual asset or campaign."
  ]
}
